nama,reviews,rating
jani,"Makanannya enak dan penyajiannya cukup cepat. Namun sayangnya pengalaman kami setelah bukber di sini sangat mengecewakan. Mobil kami digembok Dishub karena parkir di badan jalan, padahal kami parkir di situ karena diarahkan oleh tukang …",1 bintang
Yohanes E. W,"Cafe   dengan menu yang bermacam sajian yang menarik dan lezat tentunya. Pelayanan yang ramah dan suasana yang nyaman untuk menikmati hidangan sambil ngobrol bersama keluarga atau teman. Tapi waktu penyajiannya cukup memakan waktu, jika sedang ramai untuk 1 menu bisa menunggu 50 menit lebih,",5 bintang
Maraden Pangaribuan,"Tempatnya nyaman, pelayanan baik, waktu penyajian makanan perlu ditingkatkan lagi",5 bintang
Jefry Malobu,"Assalamualaikum selamat datang di lokal guide ini

■ tempat kongkow  bersama keluarga bisa …",4 bintang
Falah Putra Caesarianto (Putra),"Memutuskan datang ke sini setelah explore google review dan melihat foto-foto serta rating 4.7 dari 1200+ reviews. Setelah 3 hari dinas mendatangi beberapa cafe dan resto lain di Makassar namun mengalami kekecewaan, sehingga berharap bisa …",1 bintang
nur hikmah ramadani h,"Sdh beberapa kali dtg kesini krn suasana yg nyaman utk nongkrong.
Menu yg recommended disini ya soto betawi.
Nasi gorengnya enak-enak, cuma perlu diperhatikan lagi utk nasinya jgn sampai …",5 bintang
fiilky dwi sakti,Gak pernah bosan dengan vibes nya. Foodnya apalagi. Sup Jamurnya gak ada lawan. Our Fav food,5 bintang
lina widyawati,"Makanan enak suasana juga nyaman, cocok untuk kumpul keluargaa dan teman..ada ruang vip jugaa klo mau metting atau acara privat.. terimakasih goodfields recommended",5 bintang
Miss Paya,"Makanan lumayan enak, semua dimasak dg kematangan yg pas. Ga ada yg medok bumbunya jdi aman buat perut sensitif atau anak2. Soft ice cream juga enak.
Buat hangout sm temen, pas bgt. Ramai tpi masi bs ngobrol. Interiornya bagus n byk spot foto.",5 bintang
Hendhy Rahakbauw,"Pesan menu ice cream utk dessert, dibiarin menunggu sampe 1 jam lebih, semua waitress tiap ditanya pura2 sibuk ngecek. Bosan tanya 2-3x saya samperin, ternyata mesin eskrim sepertinya rusak/blom siap. Mau paksaa serving dalam keadaan encer. …",1 bintang
jani,"Makanannya enak dan penyajiannya cukup cepat. Namun sayangnya pengalaman kami setelah bukber di sini sangat mengecewakan. Mobil kami digembok Dishub karena parkir di badan jalan, padahal kami parkir di situ karena diarahkan oleh tukang parkir restorannya.

Selama kami berada di sana dari pukul 18.00–21.00 tidak ada pemberitahuan sama sekali dari pihak restoran bahwa mobil harus dipindahkan ke area parkir di dalam. Bahkan saat kami turun dari mobil pun tidak ada security atau tukang parkir yang memberi tahu bahwa kunci mobil bisa dititipkan.

Akibatnya kami harus menunggu sampai sekitar pukul 23.00 karena petugas Dishub baru datang saat itu. Kami sudah menyampaikan komplain ke pihak restoran, namun tidak ada bantuan ataupun permintaan maaf sama sekali.

Sangat disayangkan, padahal harga makanan di sini juga tidak murah. Minimal seharusnya ada pemberitahuan melalui speaker restoran agar pelanggan memindahkan mobilnya. Semoga ke depannya manajemennya bisa diperbaiki.",1 bintang
Jefry Malobu,"Assalamualaikum selamat datang di lokal guide ini

■ tempat kongkow  bersama keluarga bisa

■ ada tempat sholat di lantai 2 ( 2 ruangan )

■ tidak terlalu berisik

■ bagus untuk kopdar

■ HARGA pas buat tempat dan pelayanan

■ Parkir cukup lah , ok

Salam sehat dan sukses berberkah",4 bintang
Falah Putra Caesarianto (Putra),"Memutuskan datang ke sini setelah explore google review dan melihat foto-foto serta rating 4.7 dari 1200+ reviews. Setelah 3 hari dinas mendatangi beberapa cafe dan resto lain di Makassar namun mengalami kekecewaan, sehingga berharap bisa mendapatkan pengalaman berbeda di goodfields.

Datang pada 11 Feb 26, sekitar pukul 18.45. First impression utk resto yaitu ambience dan atmospherenya nyaman, fasilitas lengkap, dan cukup luas.

Saat berkunjung memang sedang ada group besar sekitar 20 pax dan beberapa pax kecil lain. Namun, melihat kapasitas resto yang cukup luas dan nyaman, tidak heran jika memang jadi pilihan utk group meals.

Sayangnya, bukannya mendapat pengalaman makan yang menyenangkan, malah berakhir kelaparan.

Diawali saat melakukan order pada sekitar pukul 19, dilayani oleh waiter pria, saya menanyakan bahwa ada 2 menu pan seared salmon dengan deskripsi yg mirip dan bedanya apa. Waiter tersebut tidak bisa jawab dan memanggil temannya yang wanita

Kemudian berganti dilayani oleh waiter yg wanita, yang saya sempat baca nametagnya merupakan trainee, menjelaskan perbedaan 2 menu pan seared salmon tersebut hanya beda di garnish dan salad, karena di deskripsi menggunakan sauce yang sama meski nama menunya berbeda, tentunya tidak menjawab kebingungan saya. Kemudian saya juga memesan ice chocolate, dengan request tidak pakai whip cream, biscuit, dan simple syrup seperti pada gambar menu. Waiter wanita mengkonfirmasi bahwa apa yakin tidak pakai simple syrup karena akan pahit. Saya dengan sadar mengkonfirmasi tidak masalah dengan rasa pahit, karena ekspektasi saya ya memang dark chocolate. Untuk makanan saya memesan soup tofu beef slice dan pan seared salmon

Setelah memesan, minuman keluar cukup cepat. Namun, saat saya coba, bukan rasa pahit seperti yg dijelaskan waiter yang saya rasakan, tetapi tetap relatif cukup manis untuk ice chocolate yg tidak ditambahkan whip cream, biscuit, dan simple syrup. Dari sini terlihat bahwa product knowledge waiter terhadap makanan & minuman yang ditawarkan tidak baik. Jika memang rasanya tetap manis, buat apa mewanti2 dari request saya bahwa akan pahit? Konyol

Yang paling konyol adalah, iya memang sedang ada group besar. Setelah menunggu sampai 1 jam lebih, makanan saya tak kunjung datang. Saat selesai pesan, waiter tidak ada konfirmasi estimasi kapan makanan akan datang. Setiap ditanya waiter tidak bisa menjawab, bilang akan ditanyakan ke kitchen, namun tidak kembali lagi memberi jawaban. Akhirnya pukul 20.15 memutuskan utk walk out bayar minuman saja yg sudah keluar.

Bisa-bisanya disuruh menunggu makanan 1 jam+ tanpa ada konfirmasi. Bahkan datang pun di hari Rabu malam yang bukan tipikal waktu orang makan keluar seperti weekend. Alasan makanan lama keluar karena sedang ada order besar (dengan adanya group besar 20 pax tersebut). Tapi yang benar saja, anda buat resto dengan kapasitas besar, tapi masa tidak bisa handle saat kapasitas resto tersebut penuh, kan konyol.

Harusnya persiapannya juga bisa lebih matang lah. Group besar kan biasanya resevasi dulu, tidak tiba2 datang. Harusnya sudah tau akan ada group besar, ya timnya bisa lebih prepare utk handle big order sekaligus. Kalau memang tidak sanggup, ya ga usah terima tamu tambahan. Bahkan, memang di lt. 1 cukup penuh, tapi lt. 2-nya masih ada beberapa meja kosong yang artinya tidak sedang full capacity. Sangat konyol dan tidak professional tidak bisa handle big order utk resto dengan kapasitas yang besar",1 bintang
nur hikmah ramadani h,"Sdh beberapa kali dtg kesini krn suasana yg nyaman utk nongkrong.
Menu yg recommended disini ya soto betawi.
Nasi gorengnya enak-enak, cuma perlu diperhatikan lagi utk nasinya jgn sampai benyek.
So far, menunya belum ada yg 'failedl' di lidah.
Untuk minuman porsinya besar ya, kadang suka dibungkus pulang soalnya sayang disisakan, rasanya enak hehe",5 bintang
Hendhy Rahakbauw,"Pesan menu ice cream utk dessert, dibiarin menunggu sampe 1 jam lebih, semua waitress tiap ditanya pura2 sibuk ngecek. Bosan tanya 2-3x saya samperin, ternyata mesin eskrim sepertinya rusak/blom siap. Mau paksaa serving dalam keadaan encer. Konyol. Sejak awal semua diam saja setiap ditanya. Sangat buang waktu menunggu lebih sejam. Komunikasi sangat buruk.",1 bintang
abrar firdaus,"Tempat nya lumayan nyaman, bersih, toilet bersih, mushalla ada,. Untuk acara kecil2an ada ruangan VIP, untuk nongki juga oke, pelayanan juga gercep.",5 bintang
Maulidah Ismi,"Paling suka sama pelayanannya dari masuk sampai keluar cafe selalu dilayani dnegan senyuman, apalagi yg antar ki makanan ku itu, cwe agk kecil² , sopan cekaliii, aku syukaaa",5 bintang
Rabiatul Adawiyah,"Mantap 👍🏻
Pelayannya ramah2 dan pelayanannya cepat 😊👍🏻
Makanannya dan minumannya enak2 🤍 …",5 bintang
Andre Michael,"Petugas valet sangat tidak membantu, saya menunggu 30 menit lebih di depan parkiran dalam kondisi saya tidak tau kalau tempat nya punya petugas valet Dan ada Mobil parkir mengahalangi slot parkiran yang kosong ,petugas petugas valetnya …",1 bintang
Ayu Rachmadany,Makanan enak dan suasananya nyaman,5 bintang
Joly Zhang,"Makanan enak, tapi untuk menunggu makanan bisa di atas 30 menit dengan keadaan resto sepi. Pesan sphagetti bolognaise 40 menit br jadi. Ini resto ga punya ya SOP brp lama serve makanan? 2x dapat kondisi begini. Pesan pizza 18:20 wita sdh …",1 bintang
Andi Mega Ningratna,"Cozy place.. Sukaaa.. Makanan cepet,enak, gak berisik, wifi lancar jaya. Suka kesini siang agak sore gak terlalu rame",5 bintang
sissyanti Kaluwulang,Salah satu cafe & Resto dengan setiap sudutnya bisa dipake foto !! Estetik banget !!! 🤍✨❤️‍🔥 bisa karolean kalo dapat dihari livemusic nya on🥳 kerensihh🙌🏻🙌🏻 …,4 bintang
Nur Aswad,Makanan & tempatnya oke,5 bintang
Nurul Hidayah,"Makanannya enak, tempatnya estetik, pelayananya bgs. Yg paling penting ada mushollah walaupun perempuan dan laki2 tdk terpisah.",5 bintang
Rabiatul Adawiyah,"Mantap 👍🏻
Pelayannya ramah2 dan pelayanannya cepat 😊👍🏻
Makanannya dan minumannya enak2 🤍",5 bintang
Andre Michael,"Petugas valet sangat tidak membantu, saya menunggu 30 menit lebih di depan parkiran dalam kondisi saya tidak tau kalau tempat nya punya petugas valet Dan ada Mobil parkir mengahalangi slot parkiran yang kosong ,petugas petugas valetnya tidak punya insiatif sama sekali untuk memberikan bantuan terkait parkiran, padahal saya parkir pas di depan pos valetnya. Saya minta batuan ke teman saya untuk memberikan informasi kepada staff terkait Mobil yang menghalangi parkiran tapi tidak ada tindakan sama sekali, Mobil saya sampai di serempet dengan Mobil lain.
Sound sistemnya bikin sakit telinga tempat bagus sound sistem buruk, suara speaker kresek"".",1 bintang
Joly Zhang,"Makanan enak, tapi untuk menunggu makanan bisa di atas 30 menit dengan keadaan resto sepi. Pesan sphagetti bolognaise 40 menit br jadi. Ini resto ga punya ya SOP brp lama serve makanan? 2x dapat kondisi begini. Pesan pizza 18:20 wita sdh bayar. Saya br terima pizza jam 19:40 wita. Tgl 18 feb 2026 jg sama. Pesan spagheti baru ada 40 menit kemudian. Nda rekomended sih buat datang",1 bintang
sissyanti Kaluwulang,Salah satu cafe & Resto dengan setiap sudutnya bisa dipake foto !! Estetik banget !!! 🤍✨❤️‍🔥 bisa karolean kalo dapat dihari livemusic nya on🥳 kerensihh🙌🏻🙌🏻,4 bintang
Cichi Wihara Baharuddin,"Nambah lagi cafe favorit,  makanan nya enak enak, ada live music nya jg. Cuman kemarin mgk karna padat banget pengunjung jadi makanan nya agak lama, itu aja sih. Selebihnya so far so good.  Oh ya 1 lagi, parkiran nya agak sempit.",5 bintang
Rizky Edy Shafira,"Bahkan bintang 1 terlalu bagus buat review resto ini. Dibiarin nunggu makanan yg sampe 1 jam lebih ga dateng, alesan orderan banyak, gaada info di awal, gaada konfirmasi, tiap ditanya ga balik lg, wasting time. Please pay attention buat …",1 bintang
roni lo vun yin,"Makanan di sana enak-enak. Saat saya cicipi, di makanan tersebut saya rasa tidak mengandung MSG. Karena beda sekali makanan yg mengandung penyedap rasa dan yg tidak. Makanan di sini pasti sangat fresh dan menyehatkan. Minuman di sana juga …",5 bintang
amaliah amir,"Sudah beberapa kali kesini, cocok buat hangout bareng teman. Tempat duduknya banyak, nyaman. Bisa juga untuk yang mau kerjain tugas. …",5 bintang
Nurul Chairany,Suasananya nyaman dengan interior yang cantik. Tapi pasta boscaiola yang kami pesan berbau kambing yang khas dan membuat mual tiap mencium aromanya.,2 bintang
Uleng Utari,"Rekomendasi : Iga Sambal Ijo
Dagingnya empuk dan bumbunya meresap, cuma sambal ijonya kurang pedas.
Nyaman buat nongki sama teman dan keluarga, interiornya keren, pelayanannya oke. Ada ruang outdoor juga.",5 bintang
RESKY RAMADHAN,"Tempatnya cozy, suasananya nyaman,tenang dan dessertnya enak2",5 bintang
Rina Afdhaliah Asri,"makanannya enak, pelayanannya ramah, tempatnya juga nyaman, untuk tempatnya bagus buat foto2. recommended🥇💗✨ …",5 bintang
Basse Herawati,"Mantap tawwa pelayanan dan makanan , yg mau kesini recomend guys ,",5 bintang
Edi Kurniawan M SE,"Secara Tempat Bagus, suasana nyaman tenang bersih dan adem, mudah di jangkau, masukan sedikit, secara, makanannya Penyajiannya Luar biasa, cuma mungkin dirasa harus lebih di perhatikan sedikit.",4 bintang
Rizky Edy Shafira,"Bahkan bintang 1 terlalu bagus buat review resto ini. Dibiarin nunggu makanan yg sampe 1 jam lebih ga dateng, alesan orderan banyak, gaada info di awal, gaada konfirmasi, tiap ditanya ga balik lg, wasting time. Please pay attention buat manager dan owner resto ini, kl gini terus lebih baik restonya tutup aja. Sangat merugikan. Ga professional!",1 bintang
roni lo vun yin,"Makanan di sana enak-enak. Saat saya cicipi, di makanan tersebut saya rasa tidak mengandung MSG. Karena beda sekali makanan yg mengandung penyedap rasa dan yg tidak. Makanan di sini pasti sangat fresh dan menyehatkan. Minuman di sana juga rasa manisnya pas tidak berlebihan. Para pelayan di sana juga sangat hebat, terlatih, dan wawasan atau pengetahuannya terhadap makanan yg ad di restoran sangat luas. Bahkan mereka bisa rekomendasikan makanan dan minuman yg disukai di restoran tersebut. Bahkan pelayan bisa menjelaskan bagaimana rasa dari masakan tersebut. Presentasi makanan sangat berkelas, rapi, dan bersih. Suasana di sana tenang. Sangat disayangkan sekali, makanan yg dipesan tidak berbarengan disajikan dan dibuat dalam waktu yg lama. Bahkan nasi goreng saja, harus menunggu hingga hampir 40 menit untuk bisa disajikan. Alhasil kami sekeluarga tdk berbarengan makanan. Tapi makanan sendiri-sendiri. Ada jeda waktu hampir 20 menit untuk setiap orang. Bahkan nasi goreng, malah terakhir yg disajikan setelah kami semua slesai makan. Padahal harusnya itu makanan yg sangat dasar sekali, yg semestinya lebih cepat disajikan. Timbul pertanyaaan, jika di waktu kunjungan yg tidak ramai seperti saat kami berkunjung hanya terlihat tidak sampai 10 orang, makanan disajikan sangat lama. Bagimana jika restoran dalam kondisi sangat ramai? Misalnya saat tiba waktu berbuka puasa.
Itu saja masukan dan saran saya. Secara keseluruhan semuanya baik. Hanya penyajian makanannya saja.yg lama.",5 bintang
amaliah amir,"Sudah beberapa kali kesini, cocok buat hangout bareng teman. Tempat duduknya banyak, nyaman. Bisa juga untuk yang mau kerjain tugas.

Disini tersedia musholla di lantai 2, mukenanya bersih, toilet juga bersih.

Untuk makanan selalu enak, sebelumnya pernah order kwetiau porsinya besar. Menunya juga beraga jadi bisa cobain satu-satu. Ini coba nasi goreng sambel ijo, rasanya lumayan, porsinya cukup untuk 1 orang.",5 bintang
Rina Afdhaliah Asri,"makanannya enak, pelayanannya ramah, tempatnya juga nyaman, untuk tempatnya bagus buat foto2. recommended🥇💗✨",5 bintang
Ellen Tjandinegara,"Semua makanan nya enak, apa lagi soto Betawi dan pizza nya. Tempat nya selalu bersih, pelayanannya sangat ramah dan siap membantu",5 bintang
Femi Hertanti,"Makananx enak2,minumanx jg oke..worth it antara harga n rasa..selalu kangen utk dtg kembali ke sini..,sy paling suka rhum vanila coffee n pizza salmon..👍👍 …",5 bintang
Beryl Cholif A (Beryl Joe),"1 Grup dengan Grind n Pull. Untuk pilihan menunya cukup banyak. Waktu itu saya di rekomendasikan coba menu barunya, Supnya cukup asin di lidah saya. Kalau untuk 2 minuman yang kami pesan itu udah pass rasanya. Ada Mushollah di lantai 2 meski cukup kecil ya jadi harus antri sholatnya. Pelayanannya juga ramah",5 bintang
Winarni K Suprimardani,"Salah satu cafe yang sangat direkomendasikan di Makassar

Penataan interior modern middle century dengan aksen tropical, memadukan warna …",5 bintang
Nurul Inayah Samman,"Tempat nyaman, pelayanan cepat, makanan enak",5 bintang
Firda Apriliani,"Pelayanannya ramah, tempatnya recomended, makanannya enak ☺️",5 bintang
Oeij Dedy Kwandy,"luas dan nyaman, dekor dan suasana nya sangat bagus . makanan dan minuman sangat bervariasi , ada desserts juga .. parkiran cukup luas .",5 bintang
Marwah Kunoichi,"Makanan enak, suasana nyaman, pelayanan gercep, instagramable (8/10)",5 bintang
Yunita,Sorry makannya terlalu biasa rasanya pdhl tempatnya oke banget. Trus lamaaa skli 40 menit utk 1 menu pdhl gak rame hanya 1 meja terisi,2 bintang
Mwona Lysa,"Malam ini goodfiels tidak siap menghadapi tamu yang banyak, alhasil makanan kluar 1 jam setelah pemesanan.. lamaaa bangettt .. ntah kurang karyawan, kurang chefnya, atau gimana.. pointnya MENGECEWAKAN .",2 bintang
Winarni K Suprimardani,"Salah satu cafe yang sangat direkomendasikan di Makassar

Penataan interior modern middle century dengan aksen tropical, memadukan warna teracota, kayu dan sentuhan hijau. Sehingga terkesan adem dan ceria.

Terdiri dari 2 lantai, indoor dan outdoor. Toilet estetik. Juga tersedia mushalla.

Untuk jenis makanan variatif, ada Indonesian food dan western food. Citarasanya pas. Untuk minuman sangat berwarna.",5 bintang
Jess Luck,"Cita rasa makanan mantap 👍
Suasana dan tempat nyaman.
Cuman kekurangan fasilitas tempat parkiran.. …",5 bintang
Dhea Karel,"Untuk makanannya enak Bangett plus bahan bahan yang di pake emang bener2 fresh, terus servicenya juga mantul dan terakhir buat suasana di sana oke juga",5 bintang
Minminc Lim,Makanan juga ok dan harga juga worth it,4 bintang
Yulisah Hasibuan,"Suasananya bagus banget,, pelayanan cepat",5 bintang
Citra Ayu Lestari,Makanannya enak parkirnya ga terlalu luas lokasi strategis tempatnya bagus ada smooking area untuk harga masih standar cafe di mks cukup recommended,4 bintang
iyan _,"Tempatnya cozy,nyaman untuk bersantai makan dan minumannya enak",5 bintang
itobil firmansyah,Utk rasa makanan enak.. burger nya mantap.. minuman juga enak.. memang pricey cuma worth it lah.. dan ternyata 1 grup dengan Grind&Pull jadi ya mirip2 style nya..,4 bintang
afifah rifa,"Menunggu makanan 1,5 jam lebih belum keluar. Padahal resto lgi tdk rame",1 bintang
Lisah T,"Makanan indo sih mayan2 enak kyk iga bakar ama sop buntut.
Kwetiao was very salty and a bit watery. …",5 bintang
kago sigma,"Makanannya enak, servicenya juga bagus. Well recommended ! Suasananya juga bagus, bisa ambil banyak foto disini!",5 bintang
Jess Luck,"Cita rasa makanan mantap 👍
Suasana dan tempat nyaman.
Cuman kekurangan fasilitas tempat parkiran..",5 bintang
Lisah T,"Makanan indo sih mayan2 enak kyk iga bakar ama sop buntut.
Kwetiao was very salty and a bit watery.

Salad was okay.",5 bintang
Eka Saktiani,"Makanannya Enak, dan Minumannya Segar2
Utk pelayanan sya ksih bintang 3 (krn pelayanannya kurang ramah) …",5 bintang
Achan Malik,"Tau tempat ini dr sejak br buka awal thn 2022, Lama gak kesini rasanya ga berubah, tetap enak. Pizza dan Ice Thai Tea nya masih yg terbaik 👍 …",5 bintang
Marchel TM,"tempatnya okay, makanan juga okay, pelayananya okay. jadi ovel all okay buat kesini. Jarang ada cafe cantik makannya enak, tapi disini makanannya enak2 🫶🏻 …",4 bintang
Herdianto Ciuandi,"Makanannya enak"" semua dan terjangkau, aplg vip no min order 🙌 …",5 bintang
Shanty Susanti Hadini,"Makanan, pelayanan, tempat dan over all bagus banget",5 bintang
Johannes Chananta,"Best, pelayannya selalu senyum, profesional, dan punya inisiatif yg baik",5 bintang
Inny Caumen,"Cafe dengan interior mewah, menunya bervariasi, pelayanan bagus, cocok untuk kalangan menengah dan atas",4 bintang
Rahma Indah Sari,"Makanan enak2, harga affordable, ambiance oke, service cepat",5 bintang
WIDYA ASTUTI,"Makanannya enak , tapi minumannya agak kurang. Pilihan makanan juga beragam",5 bintang
Makmur Jaya,"Tempat nongkrong yang enak dengan parkiran yang luas, tata ruang dan pelayanan juga bagus. Tempat ini menjadi salah satu yang recommended untuk melaksanakan pertemuan santai dengan jumlah besar",4 bintang
Eka Saktiani,"Makanannya Enak, dan Minumannya Segar2
Utk pelayanan sya ksih bintang 3 (krn pelayanannya kurang ramah)

Utk suasanya Indoornya sngat recomended utk yg Family Friendly , atau yg lgi kencan (Mau lunch atau Dinner)✌🏻",5 bintang
Achan Malik,"Tau tempat ini dr sejak br buka awal thn 2022, Lama gak kesini rasanya ga berubah, tetap enak. Pizza dan Ice Thai Tea nya masih yg terbaik 👍",5 bintang
Marchel TM,"tempatnya okay, makanan juga okay, pelayananya okay. jadi ovel all okay buat kesini. Jarang ada cafe cantik makannya enak, tapi disini makanannya enak2 🫶🏻",4 bintang
Herdianto Ciuandi,"Makanannya enak"" semua dan terjangkau, aplg vip no min order 🙌",5 bintang
raudha jaya,Pelayanan bagus.. Karyawan Ramah.. Makanan dan Minum Bintang,5 bintang
Tutee Wulandari,"Tempat cozy, pelayanan ramah, makanan enak smoga bisa di pertahankan",5 bintang
little crazy studio,"Makanannya lama sekali keluar saat ramai , 1 jam lebih bru keluar",3 bintang
imma risma,"Makanannya enak-enak, pelayanannya memuaskan dan sangat ramah. Suasananya bikin saya betah dan nyaman",5 bintang
Evita Chadija,Semua makanannya enak dan harga pas Untuk cafe sekelas mewahan,5 bintang
Diana Vonie,"Setiap kesini ga pernah kecewa sama makanannya. Apalagi kalau pesan salad, sayurnya selalu fresh. Stafnya gercep. Selalu catat request kita dgn baik dan cekatan",5 bintang
Evie Purnama Sari,"Tempatnya nyaman banyak spot foto nya juga , lantai dua masih tahap pembangunan , pilihan menu nya banyak dan enak , pegawai nya juga sangat ramah",5 bintang
Andi Astika Rianisari Mochtar,Makanannya enak2,5 bintang
himmatus syarifah,"Tempat yang nyaman dan ada live music, makanan dan minuman enak",5 bintang
Nadh Games,"Karyawan Ramah, pelayanan bagus, Karyawan  jujur dan Amanah, teliti sebab uang 400ribu saya tidak sengaja jatuh di sofa dan dikembalikan",5 bintang
asniar imran,Klo mau malam mingguan bersama orang tersayang jgn jauh² ke googfields sj..,5 bintang
Sitta Desy Ratnasari,"Makanannya enak, approve semua, interiornya juga cakepp, harga reasonable.",5 bintang
Fardhilah Kasim,"Datang pas malam minggu, ada live music. Tempatnya nyaman. Makanan enak2. Pelayanan baik 👍👍 …",5 bintang
Indira Pratiwi,"Makanannya enak, suasanyanya nyaman dan tidak terlalu berisik. Parkiran luas.",5 bintang
Aurelia Ramadhia Lumentut,"Makananya pricy tp sesuai dgn rasanya. Tempatnya nyaman, instagramable bgt.",5 bintang
Deny Wanada,"Rasa paling pas dan sangat enak
Tempat nyaman sekali
Pelayanan ramah banget",5 bintang
rindu afifa,Dari makanan semunya enak cafe fav keluarga akuiu,5 bintang
Fairuz FR,Tempatnya cozy dan makanannya enak,5 bintang
Listiyaningsih Melinda,Pelayanannya sangat baik dan ramah. Makanannya enak-enak,5 bintang
Reskiamelia reski,"Tempat Beli gorden kantor dari 2017 sampai sekarang, Kualitas memang bagus, Pengerjaanha cepat 🙏 Terimakasih …",5 bintang
Fardhilah Kasim,"Datang pas malam minggu, ada live music. Tempatnya nyaman. Makanan enak2. Pelayanan baik 👍👍",5 bintang
Andi Sri Ifa Nuraeni,"Tempatnya nyaman , makanannya enak, harganya oke, pokoknya rekomended nah",5 bintang
Farhanah Ramdhani Sumardi,"Love the vibes, service and foods.
Paling suka Chicke Caser Salad dan nasi goreng roanya juga enak🫶 …",5 bintang
Yeni Rahmawati,"Ini tempatnya cozy banget.. bisa banget dipake untum private party. waktu datang pas lagi ada birthday party, tapi kebutuhan tamu lain tidak terganggu sama sekali. waiternya gercep, toughtfull, dan tetep ramah.. makanannya enak2.. mau poto2 juga semua sudutnya instagramable.. 🤩 …",5 bintang
aldira azizah,"aku suka banget makan disini makanannya enak, bagus buat foto dan rayain ultah pacarkuu, pelayanan juga baik banget",5 bintang
Febriant Wardani,Sangat bagus terutama untuk para pelayan yang bertugas lebih ramah dan sigap membantu 👍🏻 …,5 bintang
Hanifa Syariah,"Suasana dan spot bagus, pelayanan nya juga Ramah bngett, kmarin 08 februari Siang ktemu salah satu waiters nya Cwok Putih tinggi alis nya tebal Klo gak salah namanya Andi, …",5 bintang
Sayaka,"Yes. Langganan di sini. Tempat oke, makanan enak. Mewah. Highly recomended",5 bintang
fauziah ashari,"Tempatnya nyaman,tenang cocok untuk ngobrol santai dgn kel.dan teman",5 bintang
Rahmah Tya Nuhung,"Smoking and non smoking area are available.
Ada musolah cuma lumayan kecil, hanya bisa 3 orang... jadi kudu antri. Pelayanan memuaskan. Tapi kalau boleh nama cafenya dibesarkan biar lebih mudah terlihat bagi yang lewat depan cafe.",4 bintang
Njoo Hadi,AC nya kurang dingin,4 bintang
Farhanah Ramdhani Sumardi,"Love the vibes, service and foods.
Paling suka Chicke Caser Salad dan nasi goreng roanya juga enak🫶",5 bintang
Yeni Rahmawati,"Ini tempatnya cozy banget.. bisa banget dipake untum private party. waktu datang pas lagi ada birthday party, tapi kebutuhan tamu lain tidak terganggu sama sekali. waiternya gercep, toughtfull, dan tetep ramah.. makanannya enak2.. mau poto2 juga semua sudutnya instagramable.. 🤩",5 bintang
Febriant Wardani,Sangat bagus terutama untuk para pelayan yang bertugas lebih ramah dan sigap membantu 👍🏻,5 bintang
Hanifa Syariah,"Suasana dan spot bagus, pelayanan nya juga Ramah bngett, kmarin 08 februari Siang ktemu salah satu waiters nya Cwok Putih tinggi alis nya tebal Klo gak salah namanya Andi,
Agak ksihan lhtnya Walau rame dia tetap bsa sndiri layani tamu, tp sangat di sayangkan makanan nya lambat keluar
Yaa gmn lgi maklum ada acara di lantai bawah.
Untuk masukan mungkin Pelayan nya di tambah dikit.. tapi untuk rasa makanan sangat Enaak terutama steak ayam nya dan Bgus tempat nya untuk ngedate👍
Respect buat Andii & Makanannya",5 bintang
Jusran Johan,"Makanannya enak
Tempatnya nyaman",4 bintang
